subject,instructions_time,total_time,gender,use_s1,write_down,comments,stamp,id
c92a5f733f937d8484f665d312977a06,71933,1211966,Male,No,No,"I thought of the shortest words first then said them all aloud. Once I hit May, it was pretty obvious.",8/30/18 13:15,6269
0bb80396261aed6c1d2aba6c83b73269,77737,1446311,Female,No,No,I totally choked and don't know why.,8/30/18 13:15,6270
09aba3a813cbb1bf345e16b6a60d9f39,73087,907545,Male,No,No,I didn't have any strategy but I should've thought about it beforehand.,8/30/18 13:16,6271
fde8cc853efdd3ee7c0c5afc822103f9,135806,1146431,Male,Yes,No,NONE,8/30/18 13:17,6272
0dc47bf16f6805b4cd27b42e26154304,84682,1019482,Female,No,No,"I had a plan, but then saw timer panicked and just wrote down a word.  So really terrible strategy.",8/30/18 13:17,6273
ef1e319dead8185324be041214897800,305335,2350266,Female,No,No,to follow by instructions,8/30/18 13:17,6274
e13cc44b39a06e843b35ed2b421c3096,130410,1337157,Male,Yes,No,"using may. Which not only scored high in the first round, but also has a late 3rd letter, and is also my birth month, so, lucky me! :D",8/30/18 13:18,6275
d8808f06a74a6cdfe7cd637c3275a7e5,592012,1935572,Female,Yes,No,No have comments,8/30/18 13:19,6276
e40aa0d9745b84997fb87673468da7db,110522,1204367,Female,No,No,"Look at the alphabet in my mind and tried to do it in 9 seconds

great study",8/30/18 13:20,6277
a4e8c0a777d86f3f60dc5990a2cecd8a,398626,2547118,Female,No,No,"I was thinking that ""C"" should start the word but I understood it did not it was possibly the third letter in the word, by the time I thought that time was up.",8/30/18 13:21,6278
9e2fbc4069cb5876e308aa4da7cada0f,206196,1817287,Female,No,No,no,8/30/18 13:21,6279
b36388e5b5f91071d08e75cf97e52cb3,1275228,2818786,Male,No,No,I guessed at random and felt pretty convenient when I got to November and stopped there due the time constraints.,8/30/18 13:21,6280
d752e48dcf850303dbb4e7803d50a5b2,74611,903776,Female,No,No,"No strategy, just started going through months of the year in my mind. ",8/30/18 13:21,6281
276a0e4b905c93451bd1fbd107798eff,99505,1140953,Male,No,No,,8/30/18 13:22,6282
567a4e1a4df27fbe81f09256409e2eed,85556,1741173,Female,No,No,Just tried to come up with the words very fast in my head and find the furthest letter in the alphabet possible.,8/30/18 13:23,6283
0a4594f0b359c853541f3bf56713a9f7,161578,1525265,Female,No,No,"To remember the words from Part 1 with most vowels, but I didn't count them right. ",8/30/18 13:25,6284
a6549acd26f8bb0abdc905213a1d94aa,145857,1975166,Female,No,No,"I don't have any comments for the study but it was fun to try and think of things to remember the words and numbers. I didn't have a strategy for the ""third letter"" question. But I did have a strategy for Part 1 and it was to think of them as dates instead of words and numbers and it worked out decently well actually. ",8/30/18 13:27,6285
38808dd81f60abe04ef1eea344d093be,111283,1244631,Male,No,No,"I didn't really have a strategy at first. Then I decided to go through the months in order, but I had previously wasted too much time.",8/30/18 13:27,6286
0adfea4557d2f2d036a871ca7a326aab,146710,1158470,Female,No,No,PICTURING ALL THE MONTHS SPELLED OUT WHILE LOOKING AT THE THIRD LETTER,8/30/18 13:27,6287
159537622e481c96671c739f77b95f28,59429,681914,Male,No,No,I just tried to scan all the words in my head and picked one on instinct. ,8/30/18 13:32,6288
37e0f3f7973fca47e437a7de8bb01fa3,215224,3865029,Female,No,No,"More letters in word, closest to end of alphabet for 3rd letter in word.",8/30/18 13:35,6289
210b733acb87cca4818b6bfe530bfdec,122913,2103390,Male,No,Yes,,8/30/18 13:36,6290
1b094d63a7e8d94fa3ad5f437b45d850,32372,833220,Female,Yes,No,none,8/30/18 13:36,6291
2c22b557597523a3129fdf35d016d776,176474,1668187,Female,No,No,name all the months n my head,8/30/18 13:37,6292
637f69bb67bf9b4a7cfcf286d814a1b3,54125,774162,Male,No,No,,8/30/18 13:45,6293
f07d72799371acd59c578f5da2412ec4,86239,1288861,Female,No,No,"First I thought of random months, then typed my answer (October), then thought of the months in chronological calendar order. Then I realized I should have answered ""May,"" but I wasn't sure I had enough time to change my answer.",8/30/18 13:45,6294
9e77904368aa1969aade55161b3e3e10,99423,1700571,Female,No,No,I was confused because I thought that it would be another question not the third letter I just thought that was an example so I was thrown off and it took me a few secs to realize that was what I was supposed to come up with.,8/30/18 13:46,6295
5457ea0a928f3b1703248ed48dbe55fc,485827,1162522,Male,Yes,No,No comments.,8/30/18 13:47,6296
0ce7a0ad443a1d1c0769185675196e1e,152600,2093466,Male,No,No,"I first attempted to remember the most highly rewarded words from part one, (even though they are not rewarded similarly in part two of this study) and then I began to work through each word sequentially, by month, comparing each one.",8/30/18 13:48,6297
c2b363607ece2f57c21c75e21d9bd5db,373540,1538804,Female,Yes,No,I just went with the one that came first to mind,8/30/18 13:51,6298
4a7bc07d9e10da04147fddeb42b58d72,88485,812816,Female,No,No,"I thought of november with just one second let and it was too late.  I was annoyed.  I just thought of the months as they popped in my head, no strategy.",8/30/18 13:52,6299
aa9fbb532cc2f470ee3ad86c43b7aed8,58401,928892,Male,No,No,,8/30/18 13:53,6300
b01d1beca08a3aae54d6615a4aca5262,55526,1759112,Male,No,No,Originally I was planning on going through all the months in my head but May just popped into my head and I figured that had to be the answer,8/30/18 13:55,6301
21282ff8c66a750f296972ada14ee3ed,65337,743759,Female,No,No,I just started naming months in my head that i remembered seeing and chose the first one that i thought had the qualities that i was looking for.,8/30/18 13:55,6302
68cb49700aa2ea9397bef66741389087,129282,1049056,Male,No,No,"I was just hoping it would pop into my mind, but obviously I got it wrong lol",8/30/18 13:56,6303
cd31068731d725591643b3399f7d7bd0,149560,1715756,Female,No,No,I instantly thought of October and i was like thats a T and thats pretty far back in the alphabet but i wish i would of thought of November that would have been way better! I really liked this study. ,8/30/18 13:57,6304
8884e73e7f2c3f1355c6c0932ffaf868,72879,1037008,Male,No,No,Random thinking in a short time limit.,8/30/18 13:58,6305
767df97fcce705dc56813a76e6be9c75,271063,2666925,Male,No,No,NOTHING ELSE.,8/30/18 14:00,6306
2a589257d220f186c4f5c6b9faea7795,369699,2287658,Female,No,No,I had no strategy.,8/30/18 14:02,6307
0fc085c54fece2cb7882cbfc38d6d640,125151,1406604,Female,No,No,"I didn't have one,i kinda paniced.",8/30/18 14:03,6308
773dd9945be403f143ddc26957330900,242853,1314464,Female,No,No,I was just trying to run through all the months in order so I thought about January then December popped into my mind then I just continued on with the months in order. ,8/30/18 14:04,6309
6482d9d2929a8d81e22217771bdd434d,190660,1262439,Male,No,No,"Quickly go through the months and slowly pronounce them in their abbreviated form so that I can hear the sound of the third letter. JaN, FeB, MaR, etc etc. By the time I got to May  realized that ""Y"" was the second to last letter in the alphabet and there are no months with a ""z"" in their name so it was the best I could do. I used the rest of the time to double check. ",8/30/18 14:04,6310
db05a07541adaea149cdff1f26e2ada9,161492,2715639,Male,No,No,,8/30/18 14:05,6311
73f853ce9260908747e072875e2bd111,108997,1351225,Female,No,No,I thought of the third letter in a given month and the farther into the alphabet it was I chose it.  Only one month came to mind.,8/30/18 14:05,6312
c4abfbe8b20df7abfe0bb0c90fd1c0e2,95934,1283091,Female,No,No,"Wow! This is wild, thanks!  I took your advice and relied on instinct.  I should add that I have always had a problem visualizing letters and numbers, I need to write something down to spell it or add/subtract it correctly. ",8/30/18 14:06,6313
3df53b53e2f24e8255e46d2025ee5c77,96120,1117191,Male,No,No,I went for months that I knew had later occurring letters in the alphabet.  There was a handful that I thought of quickly and it was rather easy to visualize in my mind.   I made one error in that I should have chosen November rather than October ,8/30/18 14:06,6314
2ee98f554815273ce86e2cb48c580442,176565,1277120,Female,No,No,"I just started thinking of months, and ended up writing the first one with a third letter late in the alphabet in the text box to make sure I had an answer. ",8/30/18 14:07,6315
329212deeffee2082359944e2acc4f85,107401,1258994,Female,No,No,I wrote all of the words down quickly and scanned them,8/30/18 14:10,6316
92cfa18c01ec40af67ba22a0540c09d8,139754,1565502,Male,No,No,,8/30/18 14:11,6317
bfbd0041c7d6db5d8de26a439dcac766,85963,888316,Male,Yes,No,I have no comments about the study. I just thought of the word that had the highest payout. ,8/30/18 14:12,6318
9de460851d0807281908a907f98b544a,104377,1327281,Male,No,No,Lol. I thought I was safe with November... Until I realized May was the right answer............... FOR SHAME!,8/30/18 14:15,6319
2eabf3a0e3fe1b23131f958692e50525,258288,997241,Female,No,No,"I just thought of the first one that popped in my head, and it was a good one.",8/30/18 14:15,6320
4d82f5a1d06e203d72e6a74f15b7171c,132833,1888466,Female,No,No,I think it was about three vowels,8/30/18 14:16,6321
3b9827827bbb891b230f64e8c24c4d95,169185,1950793,Male,No,No,Mentally seeing each month in my head and the third letter .. unfortunately I started with January and didn't have enough time to write down April even though that was not the best answer.,8/30/18 14:16,6322
89929bdf24a33cccae977ec717687752,182653,1795699,Female,No,No,I don't know I panicked and blanked. Also i felt the instructions weren't clear as to that I would only be picking one of the words. I thought I was going to be picking words in reference to a question. Like which out of those words had the most vowels. Which word had the most consonants.,8/30/18 14:16,6323
3478806444f4eaaff07be6464eea7a32,151531,1637942,Male,No,No,"I just quickly tried to narrow it down to months whose third letter I knew was late in the alphabet, but in so doing I skipped May because it was so short it slipped my mind.",8/30/18 14:17,6324
ffffddd95528d845416535fb41512d86,103434,1217997,Male,No,No,I just let the words pop in my head. I think if I had thought a little more I could have done better. ,8/30/18 14:20,6325
f021bd531c873042a260fababe709bf0,134416,1353363,Female,No,No,I was trying to quickly think of all the months and which one had the third letter with the most value.  ,8/30/18 14:25,6326
53b58ee63442e59eb7f263ba0399b89a,249701,1812339,Female,No,No,No strategy ,8/30/18 14:30,6327
5f78d08326b151edb25604f60c452311,87705,1048114,Male,No,No,I tried to think about the abbreviation for the words.,8/30/18 14:32,6328
63b754b7cf904e7244290ae5331628a6,92017,1171341,Male,No,No,"I thought of most of the months, and November was the highest value I thought of.",8/30/18 14:41,6329
58aaac24511756f01f64a79ef74b3f7d,168032,1424506,Female,No,No,In my mind I went through the Months in order by their abbreviated forms.,8/30/18 14:43,6330
16c9065d066d443f6bf04575e0ad88eb,109640,1137542,Female,No,No,"Tried to think of the alphabet and the 3rd letter, of course I thought of December first since C is the third letter in the alphabet and then re-read the question for late in the alphabet and thought of November.",8/30/18 14:49,6331
95184472a346c1fe198f4494d6770eca,99016,1153453,Female,Yes,No,,8/30/18 14:53,6332
7e9f6c3521d10156ad79fc57be61cc76,77095,1011148,Male,No,No,none just guessed one,8/30/18 15:00,6333
75d647002538ea6deffca8b210f7eb0e,52360,865578,Female,No,No,I just tried really quickly to think of one with a late letter. :) ,8/30/18 15:15,6334
82eefba04625f0bcf486e4fab89acf4e,149929,1788773,Female,No,No,NO QUESTIONS,8/30/18 15:17,6335
89e42390fcbb390166828993cac097a2,91610,1089238,Female,No,No,"I remembered May right at the last minute! November was the first to come to mind, and then I just didn't have enough time to mentally go through the rest of the months in my head.",8/30/18 15:47,6336