subject,instructions_time,total_time,gender,use_s1,write_down,comments,stamp,id
da1bfa5789168d47d0b72b961bb0ebc8,64425,1280433,Male,No,No,I really didn't understand that you were looking for one of the months in Part 1 therefore I really didn't have a strategy.,8/30/18 12:40,6124
b80b37f765ffdaa0574eb125e311d807,110612,1096905,Female,No,No,"November immediately popped into my head, and because I wasn't really considering May, I just stuck with November and didn't consider the other words. I'm not sure I would have considered May, because for some reason counting the third letter of a three-letter word short-circuited me.",8/30/18 12:41,6125
c7b15c3727b57d27af31ae7c4fa66072,52288,883492,Male,No,No,N/a,8/30/18 12:41,6126
dee15fbdea4f76715fefa2814e6c2006,62731,748258,Male,No,No,nope,8/30/18 12:42,6127
769c843425a08c49f5b3088889015b1b,62419,852704,Female,No,No,I was trying my best to recollect the words that I had seen but the time limit in red threw me off.,8/30/18 12:42,6128
5b455bfaf98a1cba98455083ea992a40,56258,1075836,Female,No,No,"This is a very interesting study! With the third letter question, my mind just started running through months. The first months that came to mind were ones with more letters, I don't know if that was subconscious or not. I didn't really have a strategy, except try to run through the highest third letter as quick as I could. ",8/30/18 12:42,6129
b94017fbb2e484bbb3c27dce27354251,153667,1475448,Male,No,No,"The first word that crossed my mind was ""November"" and I knew that the letter V was already pretty late in the alphabet. I sat there for a second and then said a few other months including ""May"". I then recited the alphabet from Q, R, S, etc. I realized that the letter Y is after the letter V. I had just 2 seconds remaining before changing my answer.",8/30/18 12:42,6130
a3e2f59a6195740b37f0e32637f59978,108722,1012875,Male,No,No,When i was reading the instructions my brain automatically started working to think of all the months in the year. For some reason my brain was stuck on November even though May would be a better answer. I personally found it difficult to imagine the months of the year in my head. ,8/30/18 12:42,6131
a9e93f06d6686bdf56ba795caf8b5854,78138,1209976,Male,No,No,No real strategy - just tried to run through the spelling of the months as quickly as possible.,8/30/18 12:42,6132
36d96f86edd47ac5521877aafc971d64,246446,1508566,Male,No,No,I realized after about 10 seconds that I wouldn't have time to reason all 12 months out with 10 seconds so started at beginning january and when I got to march I typed that in as letter r would get some money and then went back to least to start checking where I left off but ran out of time at april. ,8/30/18 12:43,6133
3d7505da3ca17cfcca99811d9edd288f,153791,874834,Female,No,No,no,8/30/18 12:43,6134
845d19555dc1c424e4e4584198b9f109,178563,1507717,Female,No,No,STARTED WITH THE FIRST MONTH AND STOPPED WHEN I THOUGHT I HAD THE CORRECT LETTER. ,8/30/18 12:43,6135
32fee57bff427de10767fcbd7a3ff8cd,131438,1275355,Male,No,No,thought about it,8/30/18 12:43,6136
3396a8e2e62740676f26690a298a7433,73528,1115204,Male,Yes,No,I had no strategy. I froze up and couldn't think very well.,8/30/18 12:43,6137
7e2675f9fe5beab5765d25a993f677ef,136240,1445619,Female,No,No,"I thought I would go through the months from the start of the year, but when the timer started I got worried I would not be able to enter an answer so I started typing quickly. ",8/30/18 12:43,6138
d6c8648375dfcaf1fc789965b88c14e8,88983,1007065,Female,No,No,,8/30/18 12:43,6139
206143caa74517d40e0e7fa591fea833,35281,1303702,Male,Yes,Yes,This survey work was given more than experience at this time.I am so enjoyed to do work with your task.Thanks for given this survey.,8/30/18 12:44,6140
f5056b148c1485191264d369393143d5,89496,1167212,Female,No,No,"I went through the months of the year, I was stressed about time and I kept second guessing myself",8/30/18 12:44,6141
807320756ad1ac52d7e1ae5a5a54165f,54560,1141748,Female,Yes,No,"I just said the names of the months out loud, got to May and realized there is no z in any other names of months.",8/30/18 12:44,6142
352f26728a03cf6d4c44e7e7a465cbdc,62068,908554,Female,No,No,Just used first word that came to my mind.,8/30/18 12:44,6143
07ba9fe38ffce188697916e2be87114a,64291,1252523,Male,Yes,No,its interesting survey ,8/30/18 12:44,6144
6fb220ea7142b00e51177d4f4db76995,83053,1141380,Male,No,No,"I didn't have any particular strategy. The word may just leaped into my mind quickly as if by random chance. 

Also this is the end of the study already? That's surprising! :) ",8/30/18 12:44,6145
35ca9ab5ee947db4317d9698c63470e4,146574,1039057,Female,Yes,No,,8/30/18 12:44,6146
271e4a3c84332260d72612d9e76a55d1,67896,957426,Female,No,No,Think quickly,8/30/18 12:44,6147
d40df7b733b8a7789c10b57b268e1583,70120,856078,Female,No,No,I just used my instincts.,8/30/18 12:45,6148
0003009223526f291d22323f8f83d627,132570,1422083,Female,No,No,to think through the months of year as fast as I could.,8/30/18 12:45,6149
449eeefe933db18a863687c97b703d8a,35233,542655,Male,No,No,i picked a few and figured out the latest letter i thought,8/30/18 12:45,6150
edbab59956ae4e94165fe2db03cd5664,56632,721534,Female,Yes,No,no,8/30/18 12:45,6151
2f1e01d9310879e1df87c2df9ae9e3a6,94967,918268,Female,No,No,I was starting from January and going down the list but did not make it that far.,8/30/18 12:45,6152
0589962aa5dc0df0a9d46a8cf2442339,118378,1566248,Female,No,No,I was trying to think of a month that had a lower third letter on the alphabet. I didn't even think of May until it was shown as part of the last question.,8/30/18 12:46,6153
e1940df6b4f48a45863148cd58345a21,114992,1202901,Female,No,No,I just thought through the month names real quick and considered the third letter.,8/30/18 12:46,6154
f6307e5e88a99e3a8106eda79523674b,105006,1423535,Female,No,No,"I tried to quickly go through the months to get the one with the third letter late in the alphabet.  However I overlooked May when I was going through the months. Looking back, it was so easy and I tried to make it hard.",8/30/18 12:46,6155
f1bcc6f8c9bfa12c0e781e99f9b11115,122770,1255816,Male,No,No,I enjoyed the survey. I just was spelling out the months in my head,8/30/18 12:46,6156
19f4d0e6827622a6c0106c8bdbece39e,159226,1110148,Male,No,No,"start with January then go down the months in order. as i only had 20 seconds i thought of jan, feb, and mar then skipped down to may",8/30/18 12:46,6157
de8b1142c4345543abf6130e620c14ab,154569,1302372,Male,No,No,"tried to think of words with late alphabet letters, then spelled them in my head",8/30/18 12:46,6158
94e798157ba066fe836db7bb352ea143,110361,1233659,Male,No,No,I was just going to put september but I struggled with spelling  it and ran out of time. ,8/30/18 12:47,6159
c0e3b3005c505f9f25607c7dd0b37c3d,86573,979380,Male,No,No,I did not understand the which part the part one was referring to.,8/30/18 12:47,6160
2ee7456f4928c343d0efd6f1e05b9291,109409,1207415,Male,No,No,"Think of ones after ""n""",8/30/18 12:47,6161
d3214140bbf3e4c422dfff402395b05c,65183,974654,Female,No,No,recognizing the third letter form the alphabet to avoid confusing myself then have an answer before clicking the question,8/30/18 12:47,6162
fef7b0157e34e7db74821b0c058a273e,72501,1051553,Female,No,No,start with the first month and do as far down the line before time ran out,8/30/18 12:47,6163
1930970989ca2bb6a332cd89865c32bf,169918,1566039,Female,No,No,I didnt have enough time to think so I so the timer was almost done somehow I thought about March,8/30/18 12:47,6164
6c9f6e154ef0972e52394811805090e1,225749,1415782,Female,No,No,"I thought of months with third letters beyond the letter ""N.""",8/30/18 12:47,6165
6b200e70bb2ce4fd71567b9b049f09e0,75758,850313,Female,No,No,November just popped into my mind and I tried to go from January onwards.,8/30/18 12:48,6166
a6df8258711bd6ff670294176760fd96,158943,1477097,Female,No,No,"This was fun. I was trying to go thru the list in my head and didn't have enough time. I was on april, would have hit it on MAY with 5 more seconds.",8/30/18 12:48,6167
6ce1c926c93a448198e4c7b55480bcf7,110017,1361385,Male,No,No,"November popped into my head right away, so I wrote it in the box then tried to think of a better one, but May did not come to me.",8/30/18 12:48,6168
91efd756f887f8bef42e68199327150e,67007,1221598,Male,No,No,"I seemed to latch on to the first one that came to mind, which was 'March.'",8/30/18 12:48,6169
99263e8131a35c2d25573157b6a5fe6e,88304,1142605,Male,No,No,"Quickly go through the months. Once I hit May, I knew that had to have the greatest value.",8/30/18 12:48,6170
002f639e24d298827bebae9176dab15d,138295,809881,Female,No,No,,8/30/18 12:48,6171
894bb243f1bdfc853d44bccb3602d547,86787,1700270,Male,No,No,Just think of back half of alphabet.,8/30/18 12:48,6172
2bb15589313f0e6ce6a54f2eac5c3255,106869,1067243,Male,No,No,all good,8/30/18 12:49,6173
6a68682fbfdc554350840201104cb471,94058,925349,Male,No,No,"I put down my first thought so I didn't time out, and then tried to update it with better answers.",8/30/18 12:49,6174
29962af9ccfacfed164acaf38239c6fc,47744,1125212,Male,No,No,,8/30/18 12:49,6175
23546b094a5d3c454a65fe4db5cf2e48,48025,1025626,Female,No,No,"I tried to go through the shortened versions (i.e. ""Dec"") to help me think through faster. I started with ""Nov"" and worked my way through to see if anything ""Beat"" V.",8/30/18 12:50,6176
7dc412cfbd336f46f40a1ce2ab806a9b,122200,760099,Male,Yes,No,Seeing the latest word in the alphabet,8/30/18 12:50,6177
b427854d947bf006a25509dd3f996972,158750,1030261,Female,No,No,The first word I thought of made me pretty happy. I then started going through the other months in my mind before realizing my word was pretty good.,8/30/18 12:50,6178
4e9db56abce1bc1be9855b496e9f1330,136589,1331368,Female,No,No,I did think through a few of the first months but then just tried to think of the last several letters in the alphabet and tried to fit that into a month.,8/30/18 12:50,6179
163a1bc03c61c552893ac049daa89cb0,121262,1785496,Female,No,No,I though of v w and y and started saying month names with those in my head. I missed May though for some reason. I should have just run through the 3 letter abbreviated versions of the month and I bet I would have done it in time.,8/30/18 12:50,6180
4327cdc87479a1fd7ff466b6d4329408,79770,1471482,Male,Yes,No,this didn't make any sense at all,8/30/18 12:51,6181
50b32d3a154d671432905b42a9317451,93034,1010993,Male,Yes,No,,8/30/18 12:51,6182
d38e36df70ed4aa922324847baad324b,42467,538540,Other,Yes,No,"I didn't really have one, I have a hard time remembering specific details",8/30/18 12:51,6183
fbe8c6dd2b9fd35c1d64819ad9f8a484,80224,1488119,Male,No,No,"Felt too pressured by time ended up putting December, which I think was the lowest possible answer haha.",8/30/18 12:51,6184
7e895ee6b1dfa4d366596d0fb545cf0b,62056,1029499,Male,No,No,Go through the alphabet and months quickly ,8/30/18 12:51,6185
b2caeddfb9a6f099155625b8f78cc0b9,158033,1602180,Male,No,No,,8/30/18 12:51,6186
6d2ea0dfe80166c06a6dd93e908b67d6,77314,803445,Female,No,No,none,8/30/18 12:51,6187
c12f9aef1a7af1570dfe526a0e427bef,62056,984517,Female,No,No,"I tried to just go through the months in order, writing down the month with the latest third letter and changing it as soon as I found a better one.",8/30/18 12:51,6188
b25468c157282eb7353eca9df5ded436,26575,1410858,Female,No,No,I was running through the months and stopped at March. ,8/30/18 12:51,6189
739fa6cdec687432869c2b3f4f7661ff,59324,866518,Female,No,No,I just tried to think as much as I could about the letters in the words from part 1,8/30/18 12:52,6190
4dbcce2b07db669d91d10a9e0796685d,57915,912330,Female,Yes,No,This was interesting. Honestly what ever popped in to my head.,8/30/18 12:52,6191
ce3f6984f2d3afdbd0ee14273dcb45f6,101100,1448598,Male,No,Yes,"I just thought of one of the words, and figured that the third letter was pretty late in the alphabet without really considering many others. ",8/30/18 12:52,6192
ec196239c1bd74596f87a8eec9e98a2c,269847,1133024,Female,No,No,"I tried to think as fast as possible and once I chose a word that I was satisfied with, I typed in my answer so that I didn't run out of time. Fun study, thanks!",8/30/18 12:52,6193
64954453795e5842284b21c9c8a52a82,51851,1019544,Female,No,No,I tried to figure out third letter x it's place in the alphabet,8/30/18 12:52,6194
5dd2501db69fa9de3cc9825306e9dfa7,70675,893499,Male,No,No,"I thought about the last letters of the alphabet and realized that OCT. was good, then NOV was better, then MAY was best",8/30/18 12:52,6195
c9a1bb334a968c3dc10580510600d20d,162540,1222330,Female,No,No,To try to find the latest letter possible though once I locked onto May I felt confident it was the best,8/30/18 12:52,6196
db042bb1dfda5d33c9f12732911d7b3c,185096,1358191,Female,No,No,no,8/30/18 12:53,6197
bb8394e7bc05da64aadcbf2fa6c710a0,83753,941031,Female,No,No,this was interesting,8/30/18 12:53,6198
69de4995565ae21fd31a141f53514861,130051,1257490,Male,Yes,No,"I froze when it was said and done but I was thinking about which would give me the biggest bonus, guess that kicked me in the rear.",8/30/18 12:53,6199
a1f419349a40f99ebf5affbe08f77bc3,148694,1378645,Male,No,No,"No comments. I tried to remember words from the study. Afterward, I tried to think of a word (from the study) whose third letter was late in the alphabet. ",8/30/18 12:53,6200
713448279d7fbd4fe81de3654dbacd1f,81435,1469156,Male,No,No,The answer seemed to come instantly.,8/30/18 12:53,6201
3befe9a3ac6f28a529c1670b95220d5d,102185,1258490,Female,No,No,I JUST LET ANSWERS POP IN MY HEAD.,8/30/18 12:53,6202
041bc791eb54b535da408473fa7284d3,533666,1087373,Male,No,No,n/a,8/30/18 12:53,6203
d0d113ecfdc05f1028c630985efd1cb8,137067,1720068,Male,No,No,just started thinking from january through the year,8/30/18 12:54,6204
f496bc2f8bd55beb6b7dc91963ead964,105346,946050,Female,No,No,No I don't have any comments regarding the study. I didn't have a strategy for the third letter question. ,8/30/18 12:54,6205
0df2d6ff67f7325c1e8d9d2afb2efbfb,65117,987491,Male,No,No,Honestly my mind was stuck on September for the most part and i struggled to think of any other months,8/30/18 12:54,6206
451be43cea5df478cd0430377d4331c0,125443,1264433,Female,No,No,"November was the first word that popped into my head, and I knew that the letter v was late in the alphabet, so I just used that word.  I guess May would have been better, but I am still satisfied with my choice.",8/30/18 12:54,6207
3a9133ea2326a333158225fd7d83ac09,148672,1392916,Male,No,No,very interesting study. For my strategy I visualized the words and counted 3 letters in. I chose October and had it typed but it was in the notes field. Thank you for your time. ,8/30/18 12:54,6208
b0fa3eab3b33d625f258c769463d9fef,101164,1168659,Male,No,No,I went down the list of months word by word. May had the Y in it which is a really good answer so I stopped after realizing this.,8/30/18 12:54,6209
10623f4cce275d0944cad3525cbd1473,153046,1213986,Female,No,No,I started with the first month of the year and started thinking about the third letter of each month one by one.,8/30/18 12:55,6210
7f3c8ff9f083a1aa7ccf7dfdfa602866,124803,1239014,Female,No,No,I spaced out then couldn't type fast enough,8/30/18 12:55,6211
b013d383dff33454e7fc7a5ce65b2604,93556,1565332,Male,Yes,No,,8/30/18 12:55,6212
e8ac65528bf8fe39c64194f763ca2326,86301,835761,Female,No,No,"For whatever reason, I only considered the months with more letters. I realized ""November"" too late and never even considered May. ",8/30/18 12:56,6213
c1cb65ad6b75d0c85a10bc084a9a6a93,104863,1110149,Female,No,No,I was trying to go through the calendar in my mind.,8/30/18 12:56,6214
58ed135aa71094f48ac9f5a38d73d085,72976,1164554,Female,No,No,I didn't really have one.,8/30/18 12:56,6215
d7bf8ff00cd91bfa2f648b10b5b5920e,121099,1711145,Female,No,No,"THIRD LETTER
1 2 3",8/30/18 12:57,6216
49a68e0ecfc1c9fc700c7685b9687c80,77180,976519,Female,No,No,I thought of the sound after the first vowel sound,8/30/18 12:57,6217
f70fae456a7b839b31a2d34ab9f90ba8,138884,1189749,Male,No,No,"May is my Birthday month, so that pretty much tuned my mind right in on Y.",8/30/18 12:57,6218
0a074d565f04e612c4f75950a33d4a2e,69526,1645935,Female,No,No,"Start at the beginning of the alphabet, stopped when I got to ""May"" because I know that know other months have the letter ""Z""",8/30/18 12:57,6219
ac7c61514257d802e650a8e5a2c75d2a,200001,1895624,Female,No,No,i was trying to figure out in my head what the third letter of every month that i saw in part two but i missed may in trying to beat the clock. so i was scanning through each word in my head and spelling it out which took way toolong. very fun study and i had a great time,8/30/18 12:57,6220
5a2939996d5ebb058c9255384a72b704,133533,1347273,Female,No,No,abbreviating the months in my mind,8/30/18 12:57,6221
5e90ccf33f1ffe40f334cbd4d94d83d2,165462,1476016,Female,No,No,no words popped in my head,8/30/18 12:58,6222
ef65fa2fc67965b090505c2ca1defb8a,115938,1153032,Female,No,No,"I started with January and stopped when I got to May as I know there are no months with a ""z"" in their name.",8/30/18 12:58,6223
5c550849f2b3913eca7e92dc2208792b,68992,1464842,Male,No,No,Look for word that has C in it and it was simple,8/30/18 12:58,6224
d2e845e7c79115688ad11c3ae3963608,57435,914782,Male,No,No,"I started with November, since the question before kind of prompted me that way. Then I quickly ran through the rest of the months in my mind but never really ""considered"" anything until I got to May, because I know there are no months with a Z in them.",8/30/18 12:58,6225
e159a2100cb709876f176b6110949986,113160,1243087,Female,No,No,Very fun study!  My strategy for the third letter question was just using my memory and the months of September and November first popped in to my head.  November's third letter is later in the alphabet so I went with November.,8/30/18 12:58,6226
f869c85f67f80368b2c5d3c06916c598,102796,1009964,Female,No,No,I just started at January and began to think through each month's third letter.,8/30/18 12:59,6227
6509f3edb936677e18ce9dc07d3fcffd,422173,1425120,Male,No,No,To count the letters in the alphabet.,8/30/18 12:59,6228
86ce65eaa3bb788ab791ba3821f0ccbf,36503,655290,Male,Yes,Yes,nothing,8/30/18 12:59,6229
43d343a7597e73f87424ab7026e5797f,964338,2140798,Female,No,No,No comments and the strategy I chose was to think of long words or words that may be the correct choice to earn more bonus points or certain ones that werent good choices in part one,8/30/18 12:59,6230
c7ade107a8d80dce6f800f92b2946ec1,196554,2351071,Male,No,No,,8/30/18 12:59,6231
0efd4dc2a0e5ee86a967067fe9ef9545,65599,1288855,Female,No,No,saying months in my head,8/30/18 12:59,6232
561a12a43d5cd3ea6045b40986c8ed54,156040,1189972,Male,No,No,none,8/30/18 13:00,6233
6a6ed3033651dcd879c54137ba2460bc,122641,1437642,Male,No,No,"didn't have much of a strategy I was just saying the months in my head and trying to think if the third letter was really high, I thought of may at the very last second but didn't have enough time to type it properly",8/30/18 13:00,6234
7915e0ea063846cbc88297dbcaa3f4bf,175738,2283692,Female,Yes,Yes,The more points,8/30/18 13:00,6235
497c27a31bb91d05fd07579f75e29ea2,111483,1693257,Female,No,No,"quickly running through my mind all of the months in order.  Tricked me that May was only 3 letters, and would have been the correct choice! ",8/30/18 13:01,6236
f1ec0c6a54f4c0db9c42b1e3f3edc246,130256,1680456,Female,No,No,I tried to think of the word that would have the highest value for the third letter. It took me too long so I wasn't able to earn anything for that part.,8/30/18 13:01,6237
61f309c84c297217e8bb49bba8342b15,147527,1444669,Female,No,No,No,8/30/18 13:01,6238
bdca9921d5690a862d064b0d5bf3e38d,117902,1481889,Female,No,No,"I was still think of the first three letters of the months and using the longer month names (Jan, Sept, Dec, etc). I ran out of time and didn't even guess. My odds of guessing right were practically zero so I didn't even answer the question.",8/30/18 13:02,6239
94e5ef9ffcbaba7004e44e10bd7e9b8d,138360,2136315,Male,No,No,I was confused about word choice from part 1,8/30/18 13:02,6240
0a48a9455b220ccf508849aa94eb5ef7,96009,977802,Male,No,No,I just went through the months and realized may was the best choice.,8/30/18 13:02,6241
e742a2db70549cd8650505afaf20fba8,835821,2351482,Female,No,No,First I thought November but then May came to mind And I knew right away because y is before Z,8/30/18 13:04,6242
1c6fbf9e22dcb68bd0b184adde5ccb1c,97528,925387,Female,No,No,"TRYING TO THINK QUICKLY WAS MY STRATEGY, AND BECAUSE OF IT, I RUSHED AND MISSED OUT ON THE BETTER WORDS",8/30/18 13:04,6243
1e0f20f940075dad0a8d30e1aeb0d00f,40110,726873,Female,No,No,I tried to think of letters in the last half of the alphabet and hoped for the best ,8/30/18 13:05,6244
a957f22f7e1e43aa752b83423f918b90,110491,1187645,Male,Yes,No,"To try an pick the letter that was most nearest the end of the alphabet. With a time limit, it was hard to get them all in. May was probably the best for points",8/30/18 13:05,6245
7e4573f8c151df2f21245ce7d0159f91,120174,1396749,Female,No,No,It was the first month that came to mind although it was not the best choice.,8/30/18 13:05,6246
ffb2b0a292d67a4dc062976b4b1415d0,137009,1481249,Female,No,No,thinking about a word from the months that had a late letter of the alphabet on the third letter,8/30/18 13:06,6247
57f09685d0dbf7677ccd580ee75dce24,93491,2158173,Female,No,No,"I used the practice test field on the trial question to type out the months in the order that they were organized in Part 1, in ascending point value: March February June July April October September August December November January May - I then copied the list and pasted it into the note field on the actual test item page (unsure of what the question would actually be) and then quickly scanned the third letter and made a quick decision. I was able to type in the word ""November"" and pressed ente",8/30/18 13:06,6248
0e0537a607f831f82724a09daee5527d,90061,1035765,Female,No,No,I remembered c,8/30/18 13:06,6249
19a8072f03b9f0994ba974946040a46e,175960,1938722,Male,No,No,"This was interesting. I'm still waking up/drinking coffee, so the first part was fun and simple. For the second part I literally started thinking of random months and ""September"" was the third one I thought of, and I thought ""well 'P' is sort of close to the end"". But now I feel stupid for not thinking of May, or March, or April, lol",8/30/18 13:08,6250
e0dbf2fb0a0e0ab925d2c63f9f1705ba,109182,1117067,Female,Yes,No,try to think of a month toward the end of the alphabet,8/30/18 13:08,6251
a8d3f19eaa64f4b6f8ec051907b8f960,254398,1855098,Male,No,No,I thought the study was enjoyable. I did not really have a strategy to the question. ,8/30/18 13:08,6252
05174044ae36101fa0641fc9e6fa8e5d,104017,1361427,Male,No,No,"I just started thinking about the months, got a little panicked when the timer came up and went with the first month that where the third letter was towards the end of the alphabet.",8/30/18 13:08,6253
779b97c9784d30620915c8342c3c3678,163518,1780064,Male,No,No,To try and think about as many of the month words as possible.  ,8/30/18 13:08,6254
64bd8aebd3c04d7939dcca7290de539f,64347,1084767,Female,No,No,I tried to quickly think through the alphabet and choose a word with 3 vowels that had the 3rd letter furthest down the list in the alphabet.,8/30/18 13:09,6255
364035b377d81addf68c57c641ad5753,105403,1051120,Female,Yes,No,Thinking of the letter furthest in the alphabet.,8/30/18 13:10,6256
7062e2349c3e0b582b66a5ae00a9907f,111555,1280559,Male,Yes,No,try to guess at random what months had a high value third letter,8/30/18 13:10,6257
a8d5b449a8113b8056d54aeb46d8220f,50563,1152424,Female,No,No,Thinking of names with letters towards the end of the alphabet. It was difficult to do with the time constraint. I started writing names down to visualize the letters. The timer ran out really quickly though!,8/30/18 13:10,6258
5b62c194d47fae260a58a9555b0239b4,111237,1925028,Female,No,No,"My strategy was to start with January and go through.  When I got to May, I was almost out of time, but no months have z's so that had to be the best answer.",8/30/18 13:10,6259
bf40f7c142680b0f8d50d08b7df30f44,178646,2157299,Female,No,No,20 seconds wasnt enough,8/30/18 13:10,6260
70037fa60af07aa2e3b7552e9d2cf8e4,226634,1520014,Female,No,No,,8/30/18 13:11,6261
7d1f7cc4c8cd6f326c9486eb9e59fe0c,109537,1120835,Female,Yes,No,It was a very interesting survey. I use the word that came in my mind first.,8/30/18 13:12,6262
73680ddc609b8594924dee7efe8dc622,693867,2416931,Male,No,No,"I was trying to count the position of the third letter in the months, I took too long to answer.",8/30/18 13:12,6263
ebcc63bf3c3512b0bab43a93c04058d8,172585,1423362,Male,No,No,it was nice I entertained a lot,8/30/18 13:13,6264
f2225c827ac7baa0fc73a3026967f0e9,863574,1578728,Female,No,No,The first one that popped into my head was November and then I started going through other months.  I realized too late that May would have been the best answer (barely had a second left) so I couldn't change it.,8/30/18 13:13,6265
996c71472c158bdf6d919855a80514ed,36770,1481900,Male,No,No,fun and very challenging! have a great week! my only strategy was to do the best i could as the directions got overly explained,8/30/18 13:13,6266
dd77595add91dcfbb51b6030cfef55f3,64819,909510,Female,No,No,Find the lowest letter possible in Part 1 and submit that.,8/30/18 13:14,6267
283c245195a023c51bd3beb8faebc93a,88446,2405172,Female,No,No,,8/30/18 13:15,6268
